AppId,Title,ContentDescription,Installs,Currency,Price,OffersInApp,Name,DeveloperId,Email,Website,Address,GenreId,Genre_Name,ContentRating,ContainsAds,DateReleased,name,id
com.google.android.apps.walletnfcrel,Google Wallet,"Google Wallet gives you fast, secure access to your everyday essentials. Tap to pay everywhere Google Pay is accepted, board a flight, go to a movie, and more –  all with just your phone. Keep everything protected in one place, no matter where you go.CONVENIENTGet what you need fast+ Three quick ways for accessing your everyday essentials: use your phone’s quick settings for fast access, open the Wallet app from your homescreen or use Google Assistant when your hands are busy.Access Google Wallet from your Wear OS watch+ Get instant access to Wallet on the Wear OS main watch face with complications.Carry cards, tickets, passes, and more+ Catch a train, see a concert, or earn rewards at your favorite stores  with a digital wallet that carries more+ [US Only] Unlock the world around you with a digital wallet that carries your drivers license and digital car keysWhat you need, right when you need it+ Your Wallet can suggest what you need, right when you need it. Get a notification for your boarding pass on the day of travel, so you’ll never have to fumble in your bag again.HELPFULKeep track of receipts+ Easily find transaction details in Wallet, including smart details like location pulled from Google MapsSeamless integration across Google+ Sync your Wallet to keep your Calendar and Assistant up to date with the latest info like flight updates and event notifications+ Shop smarter by seeing your point balances and loyalty benefits in Maps, Shopping, and moreGet started in a snap+ Set up is seamless with the ability to import cards, transit passes, loyalty cards and more that you’ve saved on Gmail.Stay in the know on the go+ Make boarding flights a breeze with the latest information pulled from Google Search. Google Wallet can keep you posted on gate changes or unexpected flight delays.SAFE & PRIVATEA secure way to carry it all+ Security and privacy are built into every part of Google Wallet to keep all your essentials protected.Android security you can count on+ Keep your data and essentials secure with advanced Android security features like 2-Step Verification, Find My Phone, and remotely erasing data.Tap to pay keeps your card secureALT: + When you tap to pay with your Android phone, Google Pay doesn’t share your real credit card number with the business, so your payment info stays safe.You’re in control of your data+ Easy to use privacy controls allow you to opt-in to sharing information across Google products for a tailored experience.Google Wallet is available on all Android phones (Lollipop 5.0+), Wear OS and Fitbit devices.Not all features are available for supervised accounts. Learn more about Wallet for supervised accounts here: https://support.google.com/wallet?p=about_wallet_supervised.Still have questions? Head over to support.google.com/wallet.",1200758300,USD,0,False,Google LLC,5700313618786177705,google-payments@google.com,https://pay.google.com/about,"1600 Amphitheatre Parkway, Mountain View 94043",FINANCE,Finance,Everyone,False,"Jun 24, 2011",Finance,FINANCE
net.one97.paytm,Paytm: Secure UPI Payments,"Paytm (पेटीएम), India’s #1 Payment App, is trusted by more than 45 Crore Indians. Paytm is a one-stop solution for all your payment needs:● Send money to your friends & family using your mobile number via Paytm BHIM UPI, the best bank to bank money transfer app. Including those who are not on Paytm.● Scan any QR code & make payments at grocery stores, petrol pumps, and restaurants. Use India’s most trusted mobile payment app for daily transactions & get exciting cashback.● Paytm is an all-in-one mobile recharge & bill payment app, allowing users to recharge their mobile and pay utility bills (electricity, gas, water, broadband, etc.)<b>Paytm mobile payment app is now powered by top Indian banks: Axis Bank, HDFC Bank, SBI, & Yes Bank, ensuring a seamless and secure banking experience for all its users. </b><b>Safe, reliable and superfast UPI payments</b>- Enter your mobile number & transfer money to anyone using Paytm UPI app- Check your bank account balance and view transaction history on Paytm - Your UPI ID is a unique ID used to make and receive payments using the Unified Payment Interface- Set your UPI PIN (a 4 or 6-digit number). It’s mandatory to set the PIN while creating UPI ID on the UPI payment app- Use UPI Lite for lightning-fast UPI Payments up to ₹4000 per day, no PIN requiredPaytm adds enhanced flexibility to UPI by offering the RuPay Credit Card, making secure and quick digital payments available to everyone.<b>Benefits of using RuPay Credit Card on Paytm</b>- UPI payments via credit card on Paytm effortlessly - just add your card and pay at shops without any CVV/OTP- Hassle-free & safe payments: No need to carry credit cards- Get Rewards & Cashbacks: Earn rewards, cashbacks on all your Paytm payments<b>Safe & contactless payments at offline stores</b>- Pay with Paytm UPI Payment app, using mobile number or by scanning a QR code at nearby stores, pharmacies, restaurants, petrol pumps etc. <b>Pay at online stores</b>- Make online payments on 100+ apps, including food delivery, grocery, shopping & entertainment apps <b>Easy mobile recharge & utility bill payments</b>- Recharge your mobile, DTH (TataPlay, Sun Direct, Airtel DTH, etc) or pay electricity, broadband, water bills, insurance premiums, E-Challan, Loan EMI, Municipal tax, etc.- Find the latest prepaid and postpaid recharge plans & mobile recharge offers on Jio recharge, Airtel recharge, VI recharge, MTNL & BSNL recharge on Paytm, India’s favourite recharge app.- Recharge any FASTag easily with Paytm<b>Order food, monthly groceries, and home decor items on Paytm ONDC for the best deals</b><b>Check free credit score</b><b>Get instant personal loans in India</b>● Loan amount starting from 50K to 25 lac● Repay loan 6-60 months● Annual interest rate (per annum monthly reducing): 10.99%-35%● Loan processing fee: 0-6%Note: Personal loans are available only to Indian citizens within IndiaLending partners (NBFC): ● Hero Fincorp Ltd● Aditya Birla Finance Ltd● Incred● EarlySalary (Fibe)● Poonawalla FincorpExample:Loan amount: 100,000, Interest 23%, Processing fee 4.25%, Tenure 18Loan processing fee: ₹ 4250Stamp duty charges: Applicable as per lawEMI per month: ₹ 6621Total interest: ₹ 19178Disbursal amount: ₹ 94785Amount payable: ₹ 119186<b>Book tickets for Trains, Bus, Flights</b>- Paytm is the Authorized IRCTC Partner for Rail e-ticket booking, Cancellation, PNR Status & Live Train Status<b>Contact Us</b>One 97 Communications Ltd.One Skymark, Tower-D, Plot No. H-10B,Sector-98, Noida UP 201304 IN*Paytm Money Ltd. is a wholly owned subsidiary of One97 Communication Ltd. (Paytm) and is registered with SEBI and PFRDA as Stock broker (INZ000240532) and e-pop (269042019) for NPS services.Paytm is India’s most trusted app for BHIM UPI Payments, offering fast, safe, and reliable transactions.",610413272,USD,0,False,Paytm - One97 Communications Ltd.,5032485548806526009,app.feedback@paytm.com,https://paytm.com,"B-121, Sector 5, Noida, UP, 201301",FINANCE,Finance,Everyone,True,"Apr 30, 2012",Finance,FINANCE
com.phonepe.app,"PhonePe UPI, Payment, Recharge","PhonePe is a payments app that allows you to use BHIM UPI, your credit card & debit card or wallet to recharge your mobile phone, pay all your utility bills and to make instant payments at your favourite offline & online stores. You can also invest in mutual funds & buy insurance plans on PhonePe. Get Car & Bike Insurance on our app.Link your bank account on PhonePe and transfer money with BHIM UPI instantly! The PhonePe app is safe and secure, meets all your payment, investment, mutual funds, insurance & banking needs, and is much better than Internet banking.<b>Things you can do on PhonePe (Phonepay) App:</b><b>Money Transfer, UPI Payment, Bank Transfer</b>- Money Transfer with BHIM UPI- Manage Multiple Bank Accounts– Check Account Balance, Save Beneficiaries across multiple bank accounts like SBI, HDFC, ICICI & 140+ banks.<b>Make Online Payments</b>- Make online payment on various shopping sites like Flipkart, Amazon, Myntra etc.- Pay for online food orders from Zomato, Swiggy etc.- Pay for online grocery orders from Bigbasket, Grofers etc.- Pay online for travel booking from Makemytrip, Goibibo etc.<b>Make Offline Payments</b>- Scan & Pay via QR Code at local stores like kirana, food, medicines etc.<b>Buy/Renew Insurance Policies with PhonePe Insurance App</b><b>Health & Term Life Insurance</b>- Compare/Buy Health & Term life Insurance with monthly premiums- Coverage for individuals, senior citizens & families<b>Car & Two Wheeler Insurance</b>- Browse & get India’s most popular bike & car insurance- Buy/renew your car & bike Insurance in less than 10 minutes<b>Other Insurance</b>- PA Insurance: Insure yourself against accidents & disablement- Travel Insurance: Get international travel insurance for business & leisure trips- Shop Insurance: Insure your shop against fire, theft, natural calamities and burglaries.<b>PhonePe Lending</b>Get pre-approved personal loans ready to be disbursed into your bank account through seamless & digital loan onboarding journey. Attractive interest rates, easy repayment options & single click self serve modules are some of the salient features being offered.Repayment Period: 6 - 36 MonthsInterest Rate: Max 30% (Reducing)<b>Example:</b>Principal Amount: ₹100,000Interest Rate: 15% p.a. (Reducing)Processing Fees: 2%Tenure: 12 MonthsTotal interest amount payable: ₹8309.97Total processing fee amount payable: ₹2000Total cost to the user: ₹110,309.97<b>Mutual Funds & Investments App</b>- Liquid Funds: Get higher returns than savings bank - Tax-Saving Funds: save up to ₹46,800 in tax & grow your investment- Super Funds: Achieve financial goals with expert help on our app - Equity Funds: High growth products curated as per risk appetite- Debt Funds: Get stable returns for investments without any lock-in period- Hybrid Funds: Get a balance of growth & stability - Buy or Sell 24K Pure Gold: Assured 24K purity, build gold savings on our app<b>Recharge Mobile, DTH</b>- Recharge Prepaid Mobile Numbers like Jio, Vodafone, Idea, Airtel etc.- Recharge DTH like Tata Sky, Airtel Direct, Sun Direct, Videocon etc.<b>Bill Payment</b>- Pay Credit Card Bills- Pay Landline Bills- Pay Electricity Bills- Pay Water Bills- Pay Gas Bills- Pay Broadband Bills<b>Buy PhonePe Gift Cards</b>- Buy a PhonePe Gift Card for easy payments across 1 lakh+ leading offline & online outlets and across the PhonePe app.<b>Manage your refunds</b>- Manage & track refunds from your favorite shopping websites on PhonePe.For more details, Visit www.phonepe.com<b>Permissions for App and reasons</b>SMS: to verify Phone number for registrationLocation: a requirement by NPCI for UPI transactionsContacts: for phone numbers to send money to and numbers to rechargeCamera: to scan QR codeStorage: to store scanned QR codeAccounts: to pre-populate email ID while signing upCall: to detect single vs dual sim & let user chooseMicrophone: to carry out KYC video verification",739032745,USD,0,False,PhonePe,PhonePe,support@phonepe.com,http://www.phonepe.com,"Office-2, Floor 5, Wing A, Block A,Salarpuria Softzone, Bellandur Village,Varthur Hobli, Outer Ring Road, Bangalore South,Bangalore, Karnataka, India, 560103",FINANCE,Finance,Everyone,True,"Oct 14, 2016",Finance,FINANCE
com.paypal.android.p2pmobile,"PayPal - Pay, Send, Save","PayPal is a smart and secure way to shop in-store and online, earn cash back on brands you love, send money to friends and much more. Get started in the app.SAVE OFFERS IN THE APPGet cash back offers* from brands you love. We’ll automatically apply them at checkout.*Eligible items only. Redeem points for cash or other options. Terms and exclusions apply: PayPal.com/rewards-terms SEND AND REQUEST MONEY FOR FREESecurely send and receive money with just about anyone in 120+ countriesIt’s free to send and receive with friends & family in the US when funded by a bank account or PayPal balance.GET THE PAYPAL DEBIT CARD AND EARN CASH BACKRequest your card right in the app. No credit check required.Shop with your PayPal balance everywhere Mastercard® is accepted.Earn 5% cash back on a category you choose each month**5% cash back earned as points you redeem for cash & other options on up to $1000 spend/month. Terms apply: http://paypal.com/rewardspal.A PayPal balance account is required to get the card.The PayPal Debit Mastercard® is issued by The Bancorp Bank N.A. (“Bancorp”), pursuant to a license by Mastercard International Incorporated and may be used everywhere Mastercard is accepted. Mastercard and the circles design are registered trademarks of Mastercard International Incorporated. Bancorp is issuer of the Card only and not responsible for the associated accounts or other products, services, or offers from PayPal. PayPal is a financial technology company, not a bank. The Card is linked to your PayPal Balance account. See PayPal Balance Terms and Conditions: https://www.paypal.com/us/legalhub/pp-balance-tnc#holdingCRYPTOCURRENCYBuy, sell and hold Bitcoin, Ethereum, PayPal USD, Bitcoin Cash and Litecoin with PayPal**PayPal, Inc. is licensed to engage in virtual currency business activity by the NY Dept. of Financial Services. To buy, sell, transfer, and hold crypto is subject to risks, may result in significant losses, and not available where prohibited by law. We do not make recommendations about crypto transactions. Consider seeking advice from a financial and tax advisor. Crypto custody, trades and transfer services are performed for us by Paxos Trust Co. LLC or other appropriately authorized provider. See terms: paypal.com/crypto_termsGROW YOUR MONEY WITH HIGH-YIELD PAYPAL SAVINGSRoll your money into PayPal Savings and earn a competitive APY*Easily manage your account right from the app. Transfer money in and out, set individual goals, and track your progress as your savings grows.*PayPal Savings annual percentage yield (APY) is a variable rate and can change at any time, including after the account is opened. PayPal is a financial technology company, not a bank. Banking service provided by Synchrony Bank, Member FDIC. PayPal Balance account is required to use PayPal Savings.TRACK YOUR PACKAGESView your orders and their delivery status right from the PayPal app–even if you didn’t pay with PayPal. Simply link your Gmail or Outlook to get started.Get live updates each step of the way until they arrive safely at your door.Not all sellers are participants. PAY IN 4 WITH NO LATE FEESSplit everyday purchases into 4 interest-free payments at millions of online stores.No late fees. No impact to your credit score.Manage payments right in the app.*Pay in 4 is available upon approval for purchases of $30 - $1500 and is currently not available to residents of MO or NV. 18 years old or older to apply. PayPal, Inc.: Loans to CA residents are made or arranged pursuant to a CA Financing Law License. GA Installment Lender Licensee, NMLS #910457. RI Small Loan Lender Licensee. NM residents: Go to paypal.com/us/webapps/mpp/campaigns/newmexicodisclosure. Learn more at paypal.com/payin4Availability of features varies by market.PayPal2211 N 1st St San Jose, CA 95131",399936551,USD,0,False,PayPal Mobile,PayPal+Mobile,app-feedback@paypal.com,https://www.paypal.com/mobile,,FINANCE,Finance,Everyone,False,,Finance,FINANCE
com.ubercab.eats,Uber Eats: Food Delivery,"Get food delivery to your doorstep from thousands of amazing local and national restaurants. Find the meal you crave and order food from restaurants easily with the Uber Eats app. Track your order in real-time.FIND YOUR FAVORITE FOOD & RESTAURANTSOrder food from nearby restaurants and search by cuisine, restaurant name, dish, and meal. Food delivery options for you to order and enjoy including pizza, burritos, burgers, sushi, donuts, and Chinese takeout.Prefer pickup? Skip the line and reservations and choose to pick up your order instead. Choose your favorite delivery options with the Uber Eats app now.SUBSCRIBE TO UBER ONEFor $9.99 per month, Uber One subscribers enjoy $0 Delivery Fee and up to 10% off orders over $15 at participating non-grocery stores (and 5% off orders over $35 at participating grocery stores) available on Uber Eats. Members are also eligible for rewards, perks, coupons, and offers. View full Uber One Terms & Conditions in app. ORDER ALMOST ANYTHING, ANYTIMEOrder household needs from your favorite drug stores, supermarkets, and pet shops. Baby food or diapers, pharmacy needs, beauty products and cosmetics. Grocery staples like bread and milk, bananas and produce, flowers and plants, packaged foods or frozen treats. SIMPLE DELIVERY ORDERINGPick your food order from any menu and add it to your cart with a few taps. That’s it.Uber Eats makes it easy to order food delivery online or through the app and have it delivered by restaurants and delivery people near you.Or, schedule your order in advance for a delivery person to pick it up later. Your choice!ORDER FOOD AHEAD WITH PICKUPNow you can also order food ahead for Pickup instead of just ordering delivery. Select Pickup, add food items to your cart, and skip the lines to the restaurant to get your food.REAL-TIME ORDER TRACKINGTrack your food delivery order on a map as it heads your way.See the estimated arrival time at your address.Get notified when your order arrives.FIND SOME OF YOUR FAVORITE NATIONAL RESTAURANTSSome of our food delivery partners include: Pizza Hut, Little Caesars, Buffalo Wild Wings, Papa Johns, Shake Shack, Domino’s Pizza, Nando’s, Burger King, CAVA, A&W, Chick-fil-A, Chipotle, Dunkin', IHOP, KFC, McDonald's, Panda Express, Panera, Popeyes, Shake Shack, Sonic, Starbucks, Subway, Sweetgreen, Taco Bell, Tim Hortons, Wendy's, Five Guys, Jersey Mikes, White Castle, Jack in the Box, Outback Steakhouse, Red Lobster.FIND PHARMACIES, GROCERY STORES, AND MOREOrder from grocers such as Albertsons and SEG. Other delivery partners in the pharmacy, convenience, and retail space include CVS, Walgreens, 7-Eleven, Wawa, BevMo!, and Gopuff. Order from stores such as Walmart, Walgreens, CVS and Safeway. Other delivery partners include Petco, Drizly, and Favor.ABOUT UBER EATSUber Eats is the way to order the food you love through an easy delivery experience. Uber Eats is available in hundreds of cities around the world. Enter your delivery address to explore restaurant and grocery delivery options near you.AVAILABLE INTERNATIONALLYJoin the thousands of others in your city who use the Uber Eats app to order from their favorites restaurants and schedule deliveryUber Eats is currently available in cities and metro areas including Adelaide, Amsterdam, Atlanta, Auckland, Austin, Baltimore, Brussels, Cape Town, Chicago, Dallas, Denver, Johannesburg, Glasgow, London, Los Angeles, Madrid, Melbourne, Mexico City, Miami, Milan, Nashville, New Orleans, New York, Ottawa, Paris, Philadelphia, Rio de Janeiro, San Diego, San Francisco, Seattle, Stockholm, Sydney, Taipei, Tokyo, Toronto, Warsaw, and Washington DC. Uber Eats helps you find food delivery around the world. See full list of available countries in the app.",250970712,USD,0,False,"Uber Technologies, Inc.",7908612043055486674,support@uber.com,https://www.ubereats.com,,FOOD_AND_DRINK,Food & Drink,Everyone,True,"Feb 29, 2016",Food & Drink,FOOD_AND_DRINK
com.application.zomato,Zomato: Food Delivery & Dining,"What’s your food mood today? Delicious biryani or crispy dosas, pizza or burgers, Indian sweets or cakes, chai or coffee? Whatever you feel like eating, Zomato is the only app you need for the quickest doorstep delivery or to find the best restaurants. With over 1.5 million listed restaurants, explore the best food around you with India’s most loved & trusted food app- making hungry customers happy since 2008!With the Zomato app, you can: 1) <b>Order food from your favourite restaurants</b> & eat in the comfort of your home2) <b>Find the perfect restaurant for dining out</b> 3) Explore the <b>best live experiences</b> in select cities<b>1) Order restaurant food:</b> 🍴<b>Order food anywhere, anytime</b>With online food delivery across 1000+ cities, get delivery of your favourite local & international dishes within minutes, even late at night. 📍 <b>Live order tracking & 24*7 customer support</b>Track your food order real-time: right from payment confirmation to estimated delivery time. For help, chat with our customer support executives 24*7. 💰 <b>Many safe payment options & lots of discounts</b>Pay safely & securely with UPI, cash on delivery or cards/wallets/netbanking/buy now pay later/Sodexo/Simpl. Get exciting deals & offers with up to 60% OFF or free dishes from restaurants. 💪<b>Whatever’s the occasion, we are here to serve</b>Hosting a birthday party? Have unexpected guests? Forgot to carry tiffin? Not feeling well or too tired to cook? Feel like treating yourself, trying a new cuisine or just missing an old dish you love? Don’t worry, Zomato is there to help. 👀<b>Search for & discover top restaurants, cuisines & dishes</b>Whether it's your breakfast, lunch or dinner, find the best around you with Domino’s, Pizza Hut, McDonald’s, Starbucks, Subway, Burger King, Taco Bell, KFC, Chaayos, Pasta, Burgers, Noodles, Paranthas, Lassi, Biryani, Idlis, Dal Makhani, Butter Chicken, Paneer Makhani, Dosas, Salads, Cakes, Ice Creams, Mithai, Samosas, Momos, Sushi…& a lot more. 🌿<b>Vegetarian & healthy options</b>Prefer vegetarian food? Order from veg-only restaurants or see vegetarian dishes in any restaurant. Health conscious? Indulge guilt-free with the ‘Healthy’ option on the app. Get meal recommendations curated by nutritionists for your dietary needs. ✈️<b>Intercity Legends</b> <i>(available in select cities)</i>Intercity Legends brings iconic dishes from various cities of India to your doorstep. Biryani from Hyderabad, Baked Rosogollas from Kolkata or Kebabs from Lucknow; get these & many more authentic Indian delicacies delivered.⚡<b>Instant</b> <i>(available in select cities)</i>Zomato Instant brings selected dishes from restaurants to your doorstep, in a few minutes.  <b>2) Find the perfect restaurant for dining out:</b>✅<b>Discover restaurants near you</b>Dining out? Look up restaurant menus, ratings, reviews, photos, contact details, map directions. Use search filters to find restaurants that fit your budget or are close by, or just refer to our curated lists called ‘Collections’. 👫<b>Book a table</b> Avoid waiting at restaurants by booking a table in advance. 💰<b>Special deals on dining out</b>Pay your bill on Zomato to get the biggest discounts & up to 100% cashback.👌<b>Share your experiences</b>Rate & review restaurants to share with crores of foodies.<b>3) Discover the city’s hottest events</b> :mirror_ball: Explore the pulse of the city with Zomato Live. Find the best live experiences around you and enjoy a seamless experience right from booking your tickets to attending the event itself.Available in select cities.Zomato is available across India & UAE. Some features mentioned above are live in limited locations. Every meal ordered through Zomato is 100% plastic neutral.Claim for #1 food delivery app in India is based on Play Store ratings & SimilarWeb data.",283001913,USD,0,False,Zomato,7812834815367511165,android@zomato.com,https://www.zomato.com,,FOOD_AND_DRINK,Food & Drink,Everyone,True,"Jan 10, 2011",Food & Drink,FOOD_AND_DRINK
